Year,No,Name,Topic,Summary
109,6,王明聖,教師支持與精進-教學品質與研究產能的關係,針對大學教授在教學與研究之間關係，許多研究呈現出不一致的結果，有研究認為教學與研究之問是存在著「競爭街突」的關係(因為花在研究與教學的時間會相互抵銷），也有研究指出兩者之間「没有任何」的關係，更有研究指出研究與教學是彼此「合作」的關係，將研究帶進教學往往能讓學生獲得最新領域的學習。為了回答這個問題，本校務研究透過多變項量化模型分析臺北大學教師教學(學生對教師的教學評鑑分數標準化/相對於系所的平均教學評鑑分數)與研究(老師每年發表期刊專書的研究獎勵金額)等內部相關資料，並佐以質性訪談(學術副校長、院長及研究優良教師)來初步探討教學興硏究的開係。其中量化研究發現教學興研究之間沒有關係。在影響教學方面:老師的授課時數越多會負面地影響到學生對老師的教學評鑑分數；在影響研究方面：老師申請到科技部的經費較多、年齡越年輕(相對於較長者）、副教授以上(相對於助理教授)相對也較有可能獲得期刊專書的研究獎勵金額(代表研究越強)。而質性訪談發現，助理教授階段越早獲得科技部經費與有團隊或研究導師的協助，都會正面地讓年輕學者有更多的研究能量與文章發表的可能， 本校鼓勵老師研究與教學的相關制度也在此進行評佔討論。
109,7,蘇南誠,畢業後表現與UCAN興趣探索、入學管道、課外參與、學業成績的關聯性分析,教育部推出 UCAN 就業職能平台希望協助大專生認識自己職能所需具備的能力，本校 104 學年開始大一新生於入學時全面進行施測，本計畫希望了解UCAN 調查結果可否提升學生學習成效，提供職涯發展中心未來規劃相關職能活動的参考。<br><br>整合 UCAN 調查結果、學生課程表現、學生學習參與與學生畢業流向調查的資料，本計畫設定學業成績 PR值與畢業後即投入職場工作兩個層面為學生學習成效，將UCAN 調查結果與學生學習參與視為解釋變數，採用因素分析將 16個 UCAN 構面整合成人文與理工指標，使用迴歸模型與結構方程模型來評估變數間之關聯情況。<br><br>對於畢業是否投入職場工作，以繁星入學學生有較高機率畢業投入職場工作，而人文指標分數較高、参加過職涯相關活動的學生有較高機率畢業投入職場，說明校園舉辦相關講座及說明會對於未來工作具備一定程度的成效。對於學生在校成績方面，若學生在校成績越好，對於學生畢業投入職場工作具有反向影響，說明學生成績越好，未來發展可能會繼續升學或進修等其他計畫。本計畫係以提供教學資源應用與未來教學方向參考之依據，建議投入適當的校園輔導教學資源，以期學生所學能學以致用並且增加投入職場後的職能。
109,8,吳宜珍,臺北大學對未來大學的想像,為瞭解校內教師對未來校務整體看法與創新想法，本校李校長特別指示 IR 辦公室執行專案研究，辦理全校專任教師間卷調查，以利回饋到學校未來政策的制定。據此，IR辦公室規劃研究架構藉由相關文獻史料瞭解高教精神脈絡以及臺灣教育政策的轉變、現今教育所面臨的全球化挑戰：再由數據資料進行臺北大學環境分析，最後，實行問卷調查(量化)以及深度訪談(質化）苑集本校教師對未來大學之看法。環境分析面向採用教育系統模式(輸入、過程、輸出)三個面向，以多元尺度分析法進行，評估臺北大學在三面向的辦學表現。競爭態勢分析結果顯示教學、學生多元學習為臺北大學的優勢。全校專任教師問卷調查，回收率達34%，獲得未來人才、未來學習方式、未來教學方式、未來學校機制等之共識。未來人才特質應重視(1)問題分析及解決問題的能力，(2)學習如何思考、（3)跨文化溝通交流與整合的能力；未來學習方式應重視 (1)跨領城學習，(2)多元職業探索課程；未來教學方式應重祝 (1) 講授教學，(2）創新思考教學，以學習者為中心，（3）實作教學：未來學校機制應重視終身學習，讓大學成為開放的學習中心。未來是跨領域時代，多元學習為臺北大學優勢，建議持續發展成臺北大學特色，加強人與人之間的互動，創造新的跨領域火花
108,1,蘇南誠<br>黃怡婷,探討畢業生流向調查與UCAN如何引導學生提升就業力,國立臺北大學畢業生流向調查已經收集近 10 年畢業生畢業後的就業情況，歷年的調查報告都只針對單年度的畢業生，本研究串連100 與 101 年畢業校友畢業一年、三年與五年之資料，並與其在學修課表現合併，並加入使用學校資源情況等變項，試圖了解在學情況與就業的關聯。<br><br>本研究串聯三次畢流調查後發現約 2 成畢業校友從未回覆過問卷，該部分的校友在學表現差異較大。使用有回覆校友的資料，有四成二的畢業生於畢業一年後有全職工作，畢業三年有全職工作上升至七成，畢業五年僅一成校友尚無全職工作。運用隨機截距模型建立長期薪資的預測模型，建模結果發現校友的起薪與隸屬學院與在校表現有關，其中以商學院校友且在校表現佳起薪較高，隨畢業年度愈多，薪資顯著線性成長，但隨性別不同變動趨勢明顯不同，男性畢業生薪水增加幅度較女性快。<br><br>由研究成果發現在校表現確實會與起薪有關，但因本次研究使用早期畢業生的資料，缺乏學生參與國際交換與企業實習的資料，未來若可以納入該部分，可以了解與企業接軌，以及國際化指標的效果。
108,2,胡中宜,大學生心理健康調查分析：2017-2019年,
108,3,陳婉琪,社團參與對未來職場表現之影響,許多國內外文獻指出，社團參與對大學生未來的職涯發展可能扮演舉足輕重的角色。一方面，社團參與提供了學生在課堂外自主學習參與的經驗與機會，如人際關係、實務工作能力等，進而提升其個人價值。另一方面，部分研究也指出，過度地參與社團活動有可能導致學生無法專注於課業上，進而造成其課業低落。本報告結合國立臺北大學資訊中心所提供之校務資料（90至104學年度）與2012至16年國立臺北大學大學部畢業學生的畢業流向調查資料，試圖瞭解大學部學生參與社團的決定性因素，以及社團參與對畢業滿一年之後的薪資之影響程度為何。本報告結果顯示，學生之性別、畢業年份，以及入學時的學測總級分皆對社團參與沒有顯著影響。然而部分科系（如社工系）的學生可能較熱衷參與社團。除此之外，本報告也發現社團參與對學生在校時的學業表現與未來薪資沒有顯著影響。然而，一但將學生分為「社團活躍且課業佳」、「社團活躍但課業差」、「課業佳但社團不活躍」，以及「兩種都未有積極表現」四類後，本報告發現，社團參與程度高對於未來薪資可能有負面影響。未來學校可能需要留意學生在課業與社團參與上之平衡發展。
108,4,陳易甫,適性選才、學業中斷與學業表現的後續分析,在107年度的校務研究計畫中，本人探討臺北大學選才標準與學生學業中斷的關連。具體的研究主題在於探討入學學測分數、最小篩選倍數科目與檢定標準與休學與退學的關連。雖然已經對學生學業中斷的情況有清楚的描述，然而，這樣的發現有其限制。由於研究者取得的資料缺乏學生休學或退學的時間，無法進一步探究學生停留時間與選才標準的關連。此外，除了學業中斷的現象外，學校各科系的選才標準與學生在校的表現的連結亦是另一個值得探討的議題。在不同的標準下選進來的學生，在學業表現上是否有所差異，是一個需要實證資料回答的問題。是故，本年度延續前期計畫並採用更為細緻的分析方法探討選才機制與學業中斷之間的關連並加入探討選才機制與學生在校表現的關連。結果顯示，在學業中斷上，具有明確影響力的篩選標準為國文。在控制多個相關變項的情況下，當系所未設定國文為篩選標準時，其學生有較高的學業中斷的可能性。除此之外，其他選才標準對學業中斷並沒有統計上顯著的影響。在學業成績上，在未控制選才標準對學業表現有統計顯著的影響，然而，在控制了入學管道、學測成績與性別後，這些效果就消失了，顯示兩者為虛假的關連。依據兩年的研究發現，本研究做出校務上的建議。
108,5,林茂廷,群聚修課、學生背景與學習表現,
108,6,傅健豪,學生來源與畢業流向以教育機會觀點分析多元入學方案影響,本研究探討入學管道與學生背景對就學狀況與畢業選擇的影響。利用2001-2018年校務資料及20130-2018年畢業生流向問卷調查，檢視學生來源、家庭背景、就學表現，及畢業後升學決策與初職狀況之差異。針對城鄉學生及來源地所得，比較其就學與就業表現，以追蹤近年招生模式改革產生之生源變化，對學習成效及初職表現的影響。<br><br>研究成果發現，繁星及申請入學有助於分散入學生的區域集中度，使更多來自非都會區或中低所得區域的學生進入臺北大學，其中又以繁星推薦增進弱勢生入學機會的效果最為明顯。此外，透過繁星推薦與申請入學之學生，在學表現皆較好，此結果與過往研究成果一致。但不論入學管道，來自中、低所得地區的學生，在控制學測成績後，就學後表現仍較好，且此現象在多元入學擴大實施後，才逐漸浮現。<br><br>入學管道或學生來源地區，則與畢業生的升學決策或大多數初職狀況沒有明顯的直接關係，如預期地，升學決策與部份初職表現，主要仍與在學成績較直接相關。但來自低都市化地區的學生，在畢業一年後仍待業的比例較其他地區的學生高。此外，來自弱勢家庭的畢業生，尋得初職的時間也較長。這些現象顯示，家庭資源與成長背景仍有可能影響學生的求職過程，其原因或個別差異性值得進一步探究。最後，上述結果在院系間存在明顯差異，因此各系選才模式是否影響學生來源及其就學後的配適度，值得後續研究探討。
107,1,張玉山<br>蘇南誠<br>詹場<br>/柯文乾,運用UCAN結合畢業生流向調查探討教學資源投入對學生學習及就業力之影響-資訊及數理能力對就業力之影響—以求職時間及每月薪資為例,目前大數據及人工智慧等時常被提及，而在各領域各種資訊相關的議題越來越受重視。當學生要涉及這些議題，其需具備相當的資訊能力才能對這些議題做深入瞭解，因此，資訊能力在未來將成為學生的必備能力。資訊能力的邏輯發展跟其數理能力相輔相成，數理能力好的學生，也較容易理解接受在這些領域常被使用的實證分析模型或方法。因此本研究將透過邏輯斯回歸模型去探討台北大學學生之資訊能力及數理能力，對求職時間與每月薪資的影響。而研究結果中，目前在求職時間與每月薪資兩個模型中，在透過篩選樣本之後，顯示了資訊能力對金融與合作經營學系、不動產與城鄉環境學系、企業管理系、財政系等等是有顯著幫助的。
107,2,張玉山<br>蘇南誠<br>童伊迪,運用UCAN結合畢業生流向調查探討教學資源投入對學生學習及就業力之影響-國立臺北大學原住民學生與僑生課業輔導暨大學生活適應調查,學生為例，目前原住民學生約佔總學生人數的1.05%。原住民族為台灣歷史最悠久的族群，長期以來經常面對者被壓迫、剝削及被邊緣化的地位，對於原住民族學生而言，同時面對族群文化或主流意識形態認同的窘境，在教育制度的非政治正確的優惠政策下，原住民同學面臨著制度性歧視的困境，被貶抑與低自尊是揮之不去的陰影。<br><br>有鑑於原住民族學生在校期間休學、退學人數較一般學生人數高，本研究欲了解原住民族學生在學期間的學習參與、學習成效與學習經驗。研究結果希冀能夠作為協助原住民族學生在學期間學習成效之依據，以減少其休學、退學之問題，提升其學習適應與學習自信，進而促進未來的就業力。
107,3,張玉山<br>蘇南誠<br>陳宗天,運用UCAN結合畢業生流向調查探討教學資源投入對學生學習及就業力之影響-職涯中心活動與畢業學生就業相關性調查,本研究為了解學生參與校內不同類型之職涯活動是否有利於學士班學生畢業第一年的求職情況，以幫助決策參考 – 將有限資源優先分配給對學生較有利之活動。因此欲透過統計分析來了解參與職涯活動之次數是否與求職順利度、薪資情況、工作滿意度有相關。由於職涯中心舉辦之活動類型有所不同，因此本研究將職涯中心活動區分為四個類別，分別是：徵才活動、企業實習活動、講座等分享類型的活動、以及技巧教學等工作坊互動類型與實務類型的活動。為達到以上目的，本研究使用’2011-2016職涯講座&校園徵才人數統計表’、‘103-105年詢問畢業一年後畢業生之問卷調查結果’綜合進行分析。本研究先將2011到2016年的‘職涯講座&校園徵才人數統計表’的活動參與名單根據活動性質分成四份表單，並且將相同學號之學生合併藉此統計該學生參與每類別活動之次數。接著分別對於每一年的問卷調查結果做資料清洗，最後利用學號將資料表合併。分析時將資料表分成80％的訓練集以及20%的測試集進行邏輯斯回歸。藉由Score值與p值判斷應變數是否與職涯中心活動參與相關。通過分析發現，學生畢業第一年的求職順利度與參與職涯中心活動有較高的相關性，而薪資狀況以及工作滿意度與職涯中心活動較無相關性。也因此本研究建議職涯中心未來可以嘗試改變活動，使之對於甫出社會的畢業生在求職上更有幫助。另外，本研究的活動分類方式並未與職涯中心討論並取得共識，可能與職涯中心原先規劃不同，因此可以建議職涯中心未來對所舉辦的活動進行分類，以便利往後的資料分析。
107,4,胡中宜,視覺障礙學生課業輔導方案對其學習策略與學習成就之介入成效,本研究針對本校資源教室申請課業輔導的視覺障礙學生，評估課業輔導對其學習策略與學習成就的影響。本研究採用李咏吟、張德榮、洪寶蓮等教授編制、中國行為科學社發行之《大學生學習與讀書策略量表》進行前測與後測。比較前後測之差異並綜合學生的學期成績、班級排名、課業輔導老師背景等變項，進行分析與討論。研究發現學習與讀書策略較好的學生在學期成績上表現學習與讀書策略較弱者優秀。不過最初報名課業輔導時，學習動機的差異，以及施測的時間點，成為本次的研究限制，導致整體學生學習與讀書策略測驗的前、後測差異不明顯。本研究最後提出研究限制，作為未來類似性質研究的參考。
107,5,傅健豪,生源分析：多元入學與平衡城鄉教育機會研究,平衡城鄉學生教育機會，是高等教育改革的主要目標之一。以臺北大學而言，近年雙北以外的學生雖逐年增加，但主要仍來自於高所得、高城鎮化的地區。為進一步探討入學管道、城鄉差距、與學習成效三者的關係，本研究彙整校務系統各學生歷年學習紀錄，並結合居住地資訊，檢驗不同入學管道與居住地來源學生的就學表現。研究成果有下列發現：（一）與過往校務研究及多元入學相關文獻一致，在控制入學年份及系所差異後，繁星入學的學生表現最佳，申請入學者次之，指考入學者平均成績為三者最低。（二）近年都會區學生的表現明顯不如非都會區學生，且城鄉學生表現的差距與地緣距離或入學管道無明顯關聯，即使是來自大台北地區外的學生，非都會區學生的表現仍明顯較好；而不論入學管道為何，此現象皆存在，而此現象主要於多元入學擴大實施後才浮現。（三）在考量城鄉差距後，入學管道與就學表現的關聯性明顯降低，因此過往校內研究所觀察到的入學管道表現差異，可能有相當程度來自於城鄉學生表現的差距。（四）城鄉學生表現之差距，並非普遍存在於所有院系。綜合以上結果，近年所招收之都會區學生特質可能已不同以往，而城鄉學生學習表現之差異，值得校方持續追蹤並探討其成因，以進一步協助系所規劃整體招生策略並擬定輔導資源分配。
107,6,林茂廷,圖書借閱、通識、及網路社群與學習成效之關連,本研究在了解群體對個體學習的影響，原本設定的群體互動研究對象為臉書平台，然自劍橋個資外洩事件後，臉書資料取得變得困難，故改成學生課表與同儕重疊所形成的群聚指標為分析變數。以國立臺北大學100-102學年入學之日間部學生為研究對象，我們發現，越喜歡和同儕群聚學習的學生，其（1）專業科目PR比較高，顯示同儕間有明顯的正向學習影響；然而（2）外系專業科目的學分佔比較低，同時外系專業科目的多元性也較小，顯示同儕群聚對多元興趣探索似乎有負面的影響。本研究也同時探討了圖書借閱與通識課程對學習成效的影響，初步研究發現（3）對畢業學分多且外系專業比重高的學生，書籍借閱量與PR 有正向關連；另外，（4）對於畢業學分安排相對少的學生，其通識修習科目越多，PR也較高。
107,7,陳婉琪,跨領域有用嗎？臺北大學學生之跨領域學習狀況及職場表現初探,近十年多間，教育部積極透過各類計畫案推廣跨領域學習，希望能培養多方跨領域人才，顯示跨領域學習的重要性。然同一時間，台灣正逐漸走向低薪化，大家都在問，如何提升或加值自我薪水？因此，數篇報導與研究就指出：「跨領域學習」能讓我們換位思考，並整合不同領域知識，同時提升自我薪水。真是如此嗎？為了回答此問題並瞭解本校跨領域學習情形，本報告整合本校校務資料及畢業生流向調查，係回答跨領域學習是否真的能夠讓同學在未來找工作或薪資上有所幫助？此外，本報告也提供本校各院／系所瞭解其學生修習跨領域的比率及狀態，供各單位參閱。<br><br>本次研究結果如下。2012-16年本校跨領域學習的比率有微幅上升趨勢；人文學院、社科院／歷史系、中文系完成至少一類跨領域學習的學生比例較其他院／系所來得高。再者，本報告發現，雙主修、輔系或跨領域學程的畢業生，在初職薪資上雖無明顯優勢，但仍呈現正面加值效果。而跨領域學習的優勢主要在於「跨系修課比例」本身，修習跨系課程比例越多，則其畢業後的薪資也就越高。
107,8,陳易甫,適性選才、學業中斷與初職表現,有鑑於未來大學辦學所面臨的難題，本研究利用臺北大學的校務資料結合各科系歷年選才的標準來探討大學生源流失的議題。運用2011至2017年的校務資料，本研究針對大學生休學與退學進行分析。分析結果顯示臺北大學歷年生源流失比例約在5%至7%之間。其次，有微弱的趨勢顯示此一流失比例跟學生的學測總分有關。那些學測表現較優的學生，在入學後有較高的休退學可能。在有關最小倍率科目與主科檢定標準的分析中，校務資料顯示數學能力較高的學生有較大的可能性會有休退學的情事發生。依據這些發現，本研究依據「適性選才」的原則提出相應的詮釋與建議。
107,9,吳宜珍,不同居住類型對臺北大學學生學習成效之探討,宿舍與招生問題息息相關，且臺灣近年來逐漸重視宿舍與學習發展，一些大學懷抱著理想，開始成立住宿書院或學院。顯示宿舍的教育功能逐漸成為國內外大學人才培育過程中不可或缺的一環。國內莘莘學子歷經升學競爭壓力後，進入大學就讀，首次離家居住在學校宿舍或是租賃房屋在校外，在離家缺乏父母照顧與管教的環境下，宿舍所提供的住宿生活和學習環境對大學生的發展是相當重要的。學生宿舍位於校園內，學生更能使用學校資源，因而期待住宿舍學生能比居住在校外的學生有更好的學習成績表現。但是，大學生從高中生活，離開父母的管教，住宿生亦有可能少了家人的約束，長時間沉溺於玩樂而荒廢課業，導致學習成效不佳。基於前述背景與動機，讓人欲探究不同居住類型的學生其學習成績有差異嗎?學生宿舍在校園內，會增加學生學習的機會? 藉此審視宿舍對於學生的實質助益。研究結果發現不同居住類型對學生的學業成績無顯著差異，但是在圖書館借閱量方面住宿生高於住家裡的學生，表示住宿生居住在校園會增加學習的機會。
106,1,傅健豪,生源分析：多元入學與平衡城鄉教育機會研究,高等教育規劃的重要目標之一，在於透過平衡教育機會以促進社會階級流動。近年大學招生模式的改革是否能有效落實此理念，便成為學者及政策規劃者的焦點。本研究整合校務及外部資料，分析自2001年來，臺北大學生源區域組成之變化。先以描述性統計呈現歷年入學新生來源及集中度；再進一步透過人口、收入等城鄉化指標，檢視多元入學之實施是否有助於來自資源落後區域學生之就學機會；最後比較上述情況在各學院與系所間的異同，以利於系所規劃對學生就學後的輔導策略。研究結果顯示臺北大學近年來已減少對雙北生源的依賴，學生來源的集中度也逐漸下降，但日間部入學生仍大多來自於都會區，而學生來源地區組成的歷年變化在學院與系所間有相當程度的差異。<br><br>就城鄉差距方面而言，研究發現本校自多元入學實施後，南北失衡的問題雖有逐步改善，但對學生大多來自高所得、高城鎮化地區的狀況並無明顯影響。甚至在近幾年，申請與考試入學的學生來自高所得地區的比例有逐漸增加的情況，而以繁星入學的學生來源則較接近全國平均。此外，迴歸分析的結果亦顯示單以平衡資源落差地區學生之入學機會而言，繁星入學為最有效的工具。此研究最終成果可協助校方規劃整體招生策略，透過適用於臺北大學特性之參考資料來分配未來入學管道之員額與安排適當之學業輔導，以確保兼顧生源多元化及學生適才適所的目標。
106,2,吳雪伶,各種招生管道、入學成績與學生學習成效的關聯性研究,在學生總量限制及教學設備等資源固定下，本校各學系在擬定招生政策時，必須思考如何在各種不同入學管道中取捨，藉以招收到最適合之學生。然而，過去本校在擬定招生政策時，因未曾確切掌握各種入學管道之學生學習表現而無法據以提供招生政策之參考。有鑑於此，本研究依各種不同招生管道、入學成績及其在校之學習表現進行統計分析與優劣比較，進而剖析它們之間的關聯性，藉以提供本校各學系調整其配置比例之參考。研究發現繁星推薦、學測總級分與學測國文/英文/數學成績較高的學生皆有較佳的PR值表現，但學測總級分與學測數學成績較高的學生有隨學期變動而有下降之趨勢。<br><br>本研究考慮學生學習成效應強化多面向的學習能力，而非學業成績。有鑑於此，引用歐美評鑑機制，增加100~105學年度入學的日間部學士班學生，在語文能力(TOEIC)、課外活動(參與實習、圖書館借閱次數)與在校學習表現(延畢)等三個面向加以探討。透過羅吉斯迴歸分析發現，儘管指考分發學生在PR值的表現最差，但他們在其他能力表現(如:TOEIC、參與實習、圖書館借閱次數等)卻是表現最佳。整體而言，本校繁星推薦學生的表現(除會計系與資工系外)優於推甄入學與指考分發，符合過去研究。
