Year,No,Name,Topic,Summary
106,3,程智男,招生成效：弱勢學生入學管道及學習成效表現研究,據臺灣高等教育整合資料庫及教育部相關統計，臺灣教育似有走向M型化的趨勢：家庭社經背景愈佳，就讀公立校院之機會愈大；相對富裕家庭子女可就讀學費較便宜且學校資源較豐富的公立大學，而相對弱勢家庭子女卻較常就讀學費教高的私立大學。教育失去原有促進社會階層流動之功能，實為應關注且翻轉之現象。本研究擬利用本校教務處與學務處之學生資料進行分析。我們發現多元入學管道中，繁星推薦與甄選入學並沒有不利於經濟弱勢學生，反而是指考新生中經濟弱勢比例逐年下降。同時原住民甄選入學的比例，自100學年度以來均為三個管道中最高。建議學校可以考慮增推甄與繁星管道的招生數量，促進社會階層流動，提供弱勢群體提升的機會。更進一步分析課業表現，相較於一般學生，經濟弱勢學生的學習成效與一般生接近。原住民以及身心障礙學生則有學習落後的現象，建議學校可以考慮增加輔導資源，以幫助學生。
106,4,張四明,僑生及國際生與跨國移動學習之南向招生策略分析,配合政府新南向政策大學應以「人才培育」、成為台籍企業後盾為中心，並依臺北大學優勢與各國經濟或產業需求，據以調整本校招生策略，擴大招收僑生及外籍學位生已納入臺北大學校務發展重點項目之一。<br><br>本研究旨在探討101學年度至105學年度臺北大學外籍生、僑生及陸生之入學狀況與學習滿意度，並瞭解本校學生赴外國際移動學習之意願與需求分析，以資作為研擬及調整臺北大學新南向招生策略與開拓新南向策略夥伴大學或合作姐妹校之重要參考。
106,5,李俊儀,學生選才、學習投入與學習表現之初探,本研究以臺北大學師資培育中心為例，進行選生選才、學習投入與學習表現關係之研究，師培中心學生選才主要有四種成績來源: 教育常識測驗、教育情境測驗、思考能力測驗與自傳報告成績，這些選才的依據跟學生的學習表現之間是否有關係，選才的成績是否也會影響學習投入，另外，學習投入與學生的學習表現是否也有關係，最後我們也想知道，學習投入是否為學生選才與學習表現的中介變項。本研究使用問卷調查法，針對已經修過師培課程一年以上之學生進行研究。研究結果發現，師培中心的選才確實能預測修課成績，預測力分別是思考能力>常識測驗>自傳報告>情境測驗，其中只有思考能力達到顯著，建議可以提高思考能力所佔選才的百分比。而師培中心學生的學習投入也確實能預測核心能力自評，預測力分別是行為>認知>情感，其中只有行為達到顯著，因此促進學生學習參與課程與活動的安排對於師培中心核心能力的培養有決定性的影響。
106,6,黃怡婷<br>鄭琪珍<br>賀慶軒<br>陳景皓<br>黃煜鈞<br>陳立晉<br>田弘岳<br>張喻,學習品保,
106,7,黃怡婷<br>梁丞智<br>陸薇安,教學教學評鑑,
106,8,陳婉琪,學生學習精進因素探討：學分多，學習多？,"影響學生成效的因素相當多，本計畫將聚焦於探討學生修課行為對學習成效的影響。修越多課，學習效果越好嗎？臺灣的大學課程安排比起國外是相對學期長、學分多，這樣的環境是否讓學生難以深度學習，學得多反而學不精？如果修太多課真的有負影響，對不同年級的學生都如此嗎？為了回答前述的疑惑，本文運用國立臺北大學2001至2014年（90~103學年度）的校務資料，共計1 6,419名學生，分析學生的修課學分數以及全系排名之間的關聯。從一般OLS迴歸分析的結果來看，我們發現修課學分數與全系排名之間的相關性，在不同年級的學生當中此相關性竟然大相徑庭：大一、二學生當中，修課學分數越多的人，成績越好，但對大三、四學生來說卻完全相反，修課學分數越多的人，成績越差。此結果應是由於個人特質的干擾——大一、二生，修課主動積極者同時修課多[經常是因為修輔系、雙學位]，表現也比較好；但大三、四生當中，學分數多往往是因為必須重修，而這群人的成績相對較差。為了排除個人特質的干擾，我們最後以固定效果模型(individual fixed-effect model)來分析資料。整體而言，學分數與系排名呈現負相關，但細分年級後負影響僅存在大三、四階段。換句話說，修課學分數的多寡對低年級大學生的成績並無顯著影響，但學生進入高年級後，若選擇修習學分數過多，會影響其學習表現，降低其學習效果。"
106,9,林茂廷,課程與學習效能的關連診斷,"一般對於學習成效的研究多以課業成績平均為學習效能衡量指標，然而這樣的指標受學生修課規劃影響劇烈，課業成績平均可能無法完全代表學生的學習成效。本研究利用課程內各科目的給分狀況，使用統計上的項目反應理論（Item Response Theory, IRT）, 剔除給分寬鬆度造成的課程難易差別來粹取學生成績單背後所隱含的學習效能指標。依據本校98至101學年入學的經濟系大學部學生為分析對象及其在經濟系專業科目的成績表現，進行學習成效指標粹取，做為其專業能力水準的衡量。結果發現，專業科目平均成績與專業能力的相關係數約有百分之85, 然而學生平均成績越低，其成績平均的專業能力代表性越低。因此在針對學習有困難的學生，單純使用成績為效能衡量指標可能會有偏頗。"
106,10,胡中宜,視覺障礙學生課業輔導方案對其學習策略與學習成就之介入成效,本研究針對本校資源教室申請課業輔導的視覺障礙學生，評估課業輔導對其學習策略與學習成就的影響。本研究採用李咏吟、張德榮、洪寶蓮等教授編制、中國行為科學社發行之《大學生學習與讀書策略量表》進行前測、後測與追蹤測。比較前、後與追蹤測之差異並綜合學生的學期成績、班級排名、科系等變項，進行分析與討論。研究發現學習與讀書策略較好的學生在學期成績上表現學習與讀書策略較弱者優秀。不過最初報名課業輔導時，學習動機的差異，以及施測的時間點，成為本次的研究限制，導致整體學生學習與讀書策略測驗的前、後測差異不明顯。
106,11,陳芬苓,運用UCAN結合畢流探討教學資源投入對學生學習力及就業力的影響-以公職路徑為例,鑒於本校愈來愈多學生經由考取公務人員國家考試，於各部門機關擔任職務，為社會與國家盡一份心力，而學校的教學領域、各科系的課程與學生在課內外的活動也愈來愈廣泛，本研究主要探討的問題在於了解教學需著重在哪些地方能夠使學生較有機會通過國家考試，並運用UCAN 平台之興趣探索調查結合學生考取國家考試與否的資料，進行校務研究之資料研究分析，可作為教學資源應用與調整的參考。<br><br>本研究以本校法律系、公共行政系與社會工作學系學生為樣本，透過職業興趣探索問卷、學生基本資料、修課成績及校內外的活動等資料，進行決策樹及多元邏輯斯回歸模型的分析，觀察上述哪些變項較為顯著(即值得注意的課程與特質)，並進一步分析各變項對公務人員的影響程度<br><br>由研究結果可得知，較能擔任公務人員的潛質有以下幾種：(1) 待人圓融；(2) 喜歡正確並有誠信的管理金錢；(3) 喜歡演奏樂器；(4) 喜歡在組織團體中做事；(5) 做事不喜歡講究方法；(6) 積極；(7) 樂觀；(8) 喜歡指導他人或為他人策劃活動；(9) 樂於參與進修或學習的活動。另外，學生入學的管道與是否考取公務人員具有高度相關性，學校也可加強大學部各科系重點專業課程的教學，並增強學生的外語能力(包含TOEIC、外國語文與語文兩項課程)。而若多鼓勵研究生實習與加強必修課的教學，也較能使學生走向律師一職。
